{
  "brief_id": "example-code-review-001",
  "title": "Backend code review prompt",
  "intent": "review",
  "domain": "software",
  "risk": "normal",
  "complexity": "moderate",
  "goal": "Produce a reusable code review prompt that prioritizes evidence-grounded defects and explicit uncertainty.",
  "inputs": {
    "required": ["code_or_diff", "intended_behavior"],
    "optional": ["repository_constraints", "test_results"]
  },
  "success_criteria": [
    "Findings are tied to supplied code/context",
    "Severity and confidence are explicit",
    "Unobserved runtime facts are not claimed"
  ],
  "interaction": "intake-allowed",
  "language": "en",
  "constraints": [
    "Do not invent repository context",
    "Distinguish defect, hypothesis, and style preference"
  ],
  "output_needs": {
    "structured": true,
    "alternatives": 1,
    "evidence": true,
    "citations": false
  },
  "model_targets": ["model-agnostic"],
  "notes": ["Normalized example task brief."]
}
